[{
  "id": "0001",
  "film": "Kodak 5219",
  "camera": "Nikon F2",
  "date": {
    "started": "2021-09-28",
    "finished": "2022-02-16"
  },
  "development": {
    "lab": "金陵银盐馆",
    "process": "ECN-2",
    "scanning": {
      "method": "scanner",
      "brand": "Noritsu",
      "model": "HS-1800"
    }
  },
  "note": "Pushed to 1600"
},
{
  "id": "0002",
  "film": "Fujifilm C200",
  "camera": "Pentax KX",
  "date": {
    "started": "2022-03-09",
    "finished": "2022-05-11"
  },
  "development": {
    "lab": "画英雄",
    "process": "C-41",
    "scanning": {
      "method": "camera",
      "details": "5d4 + 24-70"
    }
  },
  "note": "2014年过期胶卷"
}]